[
  { "id": "temple_tirumala_venkateswara", "name": "Tirumala Venkateswara Temple", "deity": "Lord Venkateswara", "tradition": "Vaishnava", "city": "Tirupati", "state": "Andhra Pradesh", "country": "India", "darshan": { "channel": "UCTboTRX74UydvU_cBdm_cCQ" }, "official_trust": null, "imported_from": "lib/catalog.js STATES (darshan list)", "sources": [], "verification": "needs_review", "correction_contact": "data@aastha.example" },
  { "id": "temple_parashuram_kund", "name": "Parashuram Kund", "deity": "Lord Parashuram", "tradition": "Vaishnava", "city": "Lohit", "state": "Arunachal Pradesh", "country": "India", "official_trust": null, "imported_from": "lib/catalog.js STATES (darshan list)", "sources": [], "verification": "needs_review", "correction_contact": "data@aastha.example" },
  { "id": "temple_kamakhya_devi", "name": "Kamakhya Devi Temple", "deity": "Maa Kamakhya", "tradition": "Shakta", "city": "Guwahati", "state": "Assam", "country": "India", "official_trust": null, "imported_from": "lib/catalog.js STATES (darshan list)", "sources": [], "verification": "needs_review", "correction_contact": "data@aastha.example" },
  { "id": "temple_mahabodhi", "name": "Mahabodhi Temple", "deity": "Lord Buddha", "tradition": "Buddhist", "city": "Bodh Gaya", "state": "Bihar", "country": "India", "official_trust": null, "imported_from": "lib/catalog.js STATES (darshan list)", "sources": [], "verification": "needs_review", "correction_contact": "data@aastha.example" },
  { "id": "temple_bamleshwari", "name": "Maa Bamleshwari Temple", "deity": "Maa Bamleshwari", "tradition": "Shakta", "city": "Dongargarh", "state": "Chhattisgarh", "country": "India", "official_trust": null, "imported_from": "lib/catalog.js STATES (darshan list)", "sources": [], "verification": "needs_review", "correction_contact": "data@aastha.example" },
  { "id": "temple_mangueshi", "name": "Shree Mangueshi Temple", "deity": "Lord Manguesh (Shiva)", "tradition": "Shaiva", "city": "Ponda", "state": "Goa", "country": "India", "official_trust": null, "imported_from": "lib/catalog.js STATES (darshan list)", "sources": [], "verification": "needs_review", "correction_contact": "data@aastha.example" },
  { "id": "temple_somnath", "name": "Somnath Jyotirlinga Temple", "deity": "Lord Somnath (Shiva)", "tradition": "Shaiva", "city": "Prabhas Patan", "state": "Gujarat", "country": "India", "official_trust": null, "imported_from": "lib/catalog.js STATES (darshan list)", "sources": [], "verification": "needs_review", "correction_contact": "data@aastha.example" },
  { "id": "temple_mansa_devi", "name": "Mata Mansa Devi Temple", "deity": "Maa Mansa Devi", "tradition": "Shakta", "city": "Panchkula", "state": "Haryana", "country": "India", "official_trust": null, "imported_from": "lib/catalog.js STATES (darshan list)", "sources": [], "verification": "needs_review", "correction_contact": "data@aastha.example" },
  { "id": "temple_jwala_ji", "name": "Jwala Ji Temple", "deity": "Maa Jwalamukhi", "tradition": "Shakta", "city": "Jwalamukhi", "state": "Himachal Pradesh", "country": "India", "official_trust": null, "imported_from": "lib/catalog.js STATES (darshan list)", "sources": [], "verification": "needs_review", "correction_contact": "data@aastha.example" },
  { "id": "temple_baidyanath_dham", "name": "Baidyanath Dham", "deity": "Lord Baidyanath (Shiva)", "tradition": "Shaiva", "city": "Deoghar", "state": "Jharkhand", "country": "India", "official_trust": null, "imported_from": "lib/catalog.js STATES (darshan list)", "sources": [], "verification": "needs_review", "correction_contact": "data@aastha.example" },
  { "id": "temple_krishna_matha_udupi", "name": "Sri Krishna Matha", "deity": "Lord Krishna", "tradition": "Vaishnava", "city": "Udupi", "state": "Karnataka", "country": "India", "official_trust": null, "imported_from": "lib/catalog.js STATES (darshan list)", "sources": [], "verification": "needs_review", "correction_contact": "data@aastha.example" },
  { "id": "temple_sabarimala", "name": "Sabarimala Ayyappa Temple", "deity": "Lord Ayyappa", "tradition": "Other", "city": "Pathanamthitta", "state": "Kerala", "country": "India", "official_trust": null, "imported_from": "lib/catalog.js STATES (darshan list)", "sources": [], "verification": "needs_review", "correction_contact": "data@aastha.example" },
  { "id": "temple_mahakaleshwar", "name": "Mahakaleshwar Jyotirlinga Temple", "deity": "Lord Mahakal (Shiva)", "tradition": "Shaiva", "city": "Ujjain", "state": "Madhya Pradesh", "country": "India", "official_trust": null, "imported_from": "lib/catalog.js STATES (darshan list)", "sources": [], "verification": "needs_review", "correction_contact": "data@aastha.example" },
  { "id": "temple_siddhivinayak", "name": "Shree Siddhivinayak Temple", "deity": "Lord Ganesha", "tradition": "Ganapatya", "city": "Mumbai", "state": "Maharashtra", "country": "India", "darshan": { "videoId": "1oS-N5Y0QHI" }, "official_trust": null, "imported_from": "lib/catalog.js STATES (darshan list)", "sources": [], "verification": "needs_review", "correction_contact": "data@aastha.example" },
  { "id": "temple_govindajee", "name": "Shree Govindajee Temple", "deity": "Lord Govindajee", "tradition": "Vaishnava", "city": "Imphal", "state": "Manipur", "country": "India", "official_trust": null, "imported_from": "lib/catalog.js STATES (darshan list)", "sources": [], "verification": "needs_review", "correction_contact": "data@aastha.example" },
  { "id": "temple_nartiang_durga", "name": "Nartiang Durga Temple", "deity": "Maa Durga (Shakti Peeth)", "tradition": "Shakta", "city": "Jaintia Hills", "state": "Meghalaya", "country": "India", "official_trust": null, "imported_from": "lib/catalog.js STATES (darshan list)", "sources": [], "verification": "needs_review", "correction_contact": "data@aastha.example" },
  { "id": "temple_solomons_aizawl", "name": "Solomon's Temple", "deity": "Christian shrine", "tradition": "Other", "city": "Aizawl", "state": "Mizoram", "country": "India", "official_trust": null, "imported_from": "lib/catalog.js STATES (darshan list)", "sources": [], "verification": "needs_review", "correction_contact": "data@aastha.example" },
  { "id": "temple_dimapur_kalibari", "name": "Dimapur Kalibari", "deity": "Maa Kali", "tradition": "Shakta", "city": "Dimapur", "state": "Nagaland", "country": "India", "official_trust": null, "imported_from": "lib/catalog.js STATES (darshan list)", "sources": [], "verification": "needs_review", "correction_contact": "data@aastha.example" },
  { "id": "temple_jagannath_puri", "name": "Shree Jagannath Temple", "deity": "Lord Jagannath", "tradition": "Vaishnava", "city": "Puri", "state": "Odisha", "country": "India", "official_trust": null, "imported_from": "lib/catalog.js STATES (darshan list)", "sources": [], "verification": "needs_review", "correction_contact": "data@aastha.example" },
  { "id": "temple_golden_temple", "name": "Golden Temple (Harmandir Sahib)", "deity": "Sri Guru Granth Sahib", "tradition": "Sikh", "city": "Amritsar", "state": "Punjab", "country": "India", "official_trust": null, "imported_from": "lib/catalog.js STATES (darshan list)", "sources": [], "verification": "needs_review", "correction_contact": "data@aastha.example" },
  { "id": "temple_khatu_shyam", "name": "Khatu Shyam Ji Temple", "deity": "Khatu Shyam (Krishna)", "tradition": "Vaishnava", "city": "Sikar", "state": "Rajasthan", "country": "India", "official_trust": null, "imported_from": "lib/catalog.js STATES (darshan list)", "sources": [], "verification": "needs_review", "correction_contact": "data@aastha.example" },
  { "id": "temple_rumtek", "name": "Rumtek Monastery", "deity": "Buddhist Dharmachakra", "tradition": "Buddhist", "city": "Gangtok", "state": "Sikkim", "country": "India", "official_trust": null, "imported_from": "lib/catalog.js STATES (darshan list)", "sources": [], "verification": "needs_review", "correction_contact": "data@aastha.example" },
  { "id": "temple_meenakshi", "name": "Meenakshi Amman Temple", "deity": "Maa Meenakshi", "tradition": "Shakta", "city": "Madurai", "state": "Tamil Nadu", "country": "India", "official_trust": null, "imported_from": "lib/catalog.js STATES (darshan list)", "sources": [], "verification": "needs_review", "correction_contact": "data@aastha.example" },
  { "id": "temple_yadadri_narasimha", "name": "Yadadri Lakshmi Narasimha Temple", "deity": "Lord Narasimha", "tradition": "Vaishnava", "city": "Yadagirigutta", "state": "Telangana", "country": "India", "official_trust": null, "imported_from": "lib/catalog.js STATES (darshan list)", "sources": [], "verification": "needs_review", "correction_contact": "data@aastha.example" },
  { "id": "temple_tripura_sundari", "name": "Tripura Sundari Temple", "deity": "Maa Tripura Sundari (Shakti Peeth)", "tradition": "Shakta", "city": "Udaipur (Tripura)", "state": "Tripura", "country": "India", "official_trust": null, "imported_from": "lib/catalog.js STATES (darshan list)", "sources": [], "verification": "needs_review", "correction_contact": "data@aastha.example" },
  { "id": "temple_kashi_vishwanath", "name": "Kashi Vishwanath Temple", "deity": "Lord Vishwanath (Shiva)", "tradition": "Shaiva", "city": "Varanasi", "state": "Uttar Pradesh", "country": "India", "darshan": { "channel": "UCdMj2twWfMHXrWgX5oVdoyA" }, "official_trust": null, "imported_from": "lib/catalog.js STATES (darshan list)", "sources": [], "verification": "needs_review", "correction_contact": "data@aastha.example" },
  { "id": "temple_kedarnath", "name": "Kedarnath Dham", "deity": "Lord Kedarnath (Shiva)", "tradition": "Shaiva", "city": "Rudraprayag", "state": "Uttarakhand", "country": "India", "official_trust": null, "imported_from": "lib/catalog.js STATES (darshan list)", "sources": [], "verification": "needs_review", "correction_contact": "data@aastha.example" },